<?xml version="1.0" encoding="UTF-8"?>
<!DOCTYPE aliens SYSTEM "a.dtd">

<aliens>
    <alien aid = "tt" lang = "p">
        <name>Aakash Darsi</name>
        <Age>20</Age>

        <Gender>Male</Gender>       
    </alien>
    
    <alien aid = "pp" lang="C"> 
        <name>Bharani</name>
        <Age>22</Age>


        <Gender>Male</Gender>
    </alien>

</aliens>
